{"$schema":"https://json-schema.org/draft/2020-12/schema","$id":"https://schemas.kujolang.ai/searchbridge/batch.v1.json","type":"object","required":["schema","bounded_concurrency","succeeded","failed","results"],"properties":{"schema":{"const":"searchbridge.batch/v1"},"bounded_concurrency":{"type":"integer","minimum":1,"maximum":32},"execution":{"type":"string"},"cancel_file":{"type":"string"},"succeeded":{"type":"integer","minimum":0},"failed":{"type":"integer","minimum":0},"results":{"type":"array"}},"additionalProperties":false}
