{"bounded_concurrency":4,"execution":"bounded-sequential","failed":0,"results":[{"command":"pagespeed","ok":true,"value":{"capability":"page.performance","evidence_classes":["lab","field-if-returned"],"mode":"fixture","pagination":{"max_pages":10,"max_total_rows":1000,"page_size":100,"pages_fetched":1,"strategy":"none"},"provider":"pagespeed-insights","retrieved_at":"1970-01-01T00:00:00Z","rows":[{"field":{"metrics":{"LARGEST_CONTENTFUL_PAINT_MS":{"category":"FAST"}}},"lab":{"accessibility":0.96,"best-practices":0.95,"performance":0.91,"seo":1.0},"metrics":{"cumulative-layout-shift":0.03,"largest-contentful-paint":1800,"server-response-time":120,"total-blocking-time":80},"strategy":"mobile","url":"https://example.com/"}],"schema":"searchbridge.result/v1","target":"https://example.com/","telemetry":{"attempts":0,"cache_status":"fixture","cost_class":"provider-quota","latency_ms":0,"provider_cost":{},"response_bytes":0,"retries":0,"retry_delay_ms":0,"rows":1,"truncated":false}}},{"command":"crux","ok":true,"value":{"capability":"field.performance","mode":"fixture","pagination":{"max_pages":10,"max_total_rows":1000,"page_size":100,"pages_fetched":1,"strategy":"none"},"provider":"crux","retrieved_at":"1970-01-01T00:00:00Z","rows":[{"collection_period":{"firstDate":{"day":1,"month":7,"year":2026},"lastDate":{"day":28,"month":7,"year":2026}},"form_factor":"PHONE","metrics":{"cumulative_layout_shift":{"percentiles":{"p75":"0.05"}},"largest_contentful_paint":{"histogram":[{"density":0.8,"end":2500,"start":0}],"percentiles":{"p75":2100}}},"url":"https://example.com/"}],"schema":"searchbridge.result/v1","target":"https://example.com/","telemetry":{"attempts":0,"cache_status":"fixture","cost_class":"provider-quota","latency_ms":0,"provider_cost":{},"response_bytes":0,"retries":0,"retry_delay_ms":0,"rows":1,"truncated":false}}}],"schema":"searchbridge.batch/v1","succeeded":2}
